employee_id,first_name,last_name,address,email,city,country,description,hospital_name,salary,type_of_employment,hospital_id
1,John,Mason,123 st Taylor st,john@gmail.com,Chicago,United States,My name is John and I am an ontological specialist in the Chicago downtown.,Crosshospital,"100,000",Doctor,1
2,Daniel,Micheal,south miller,xyz@gmail.com,Chicago,USA,my name is dianeal,sunshine,50000,doctor,2
3,Jacob,Thro,"234 st Main road, Apt 4",jacob@gmail.com,Austin,US,Jacob is on the leading general practioners.,Merry hospital,"120,000",Nurse,3
4,harshith,alle,Gandhinagar,har@gmail.com,hyderbad,country,I am a workboy,srikara,40000,workboy,4
5,James,Thames,65 Berkley st,james@gmail.com,Berkley,UK,James is a general surgeon and a neurosurgeon.,red cross,"140,000",doctor,5
